{
  "$schema": "https://json-schema.org/draft/2020-12/schema",
  "$id": "https://hero.dev/contracts/attention/mailthread/v1/migration-result.schema.json",
  "type": "object",
  "required": ["schema_version", "thread", "created", "source"],
  "properties": {
    "schema_version": {"const": 1},
    "thread": {"$ref": "thread-view.schema.json"},
    "created": {"type": "boolean"},
    "source": {"const": "mailread_v1"}
  }
}
