[
  {"schema_version":1,"thread":{"state":{"schema_version":1,"identity":{"project_peer_id":"peer_alpha","thread_id":"mail_legacy"},"lifecycle":"open","revision":31},"read":{"message_count":1,"unread_count":1},"actions":[{"id":"resolve","label":"Resolve","operation_id":"mail.resolve","effect":"state_write","consent":"explicit_user","input_schema":{"type":"object"},"required_row_revision":31,"requires_idempotency":true},{"id":"archive","label":"Archive","operation_id":"mail.archive","effect":"state_write","consent":"explicit_user","input_schema":{"type":"object"},"required_row_revision":31,"requires_idempotency":true}]},"created":true,"source":"mailread_v1"},
  {"schema_version":1,"thread":{"state":{"schema_version":1,"identity":{"project_peer_id":"peer_alpha","thread_id":"mail_dismissed"},"lifecycle":"archived","revision":32,"resolution":{"reason":"migrated_dismissed","source":"mailread_v1","outcome":"dismissed"},"grace_class":"informational","resolved_at":"2026-08-01T12:00:00Z","archived_at":"2026-08-01T12:00:00Z"},"read":{"message_count":2,"unread_count":0},"actions":[{"id":"restore","label":"Restore","operation_id":"mail.restore","effect":"state_write","consent":"explicit_user","input_schema":{"type":"object"},"required_row_revision":32,"requires_idempotency":true}]},"created":true,"source":"mailread_v1"}
]
